pmid,abstract,composite_endpoints,num_of_composite,composite_type1,composite_stats_type1,composite_type2,composite_stats_type2,disease_cat,publication_year,create_date,doi
33031764,"BACKGROUND: Lopinavir-ritonavir has been proposed as a treatment for COVID-19 on the basis of in vitro activity, preclinical studies, and observational studies. Here, we report the results of a randomised trial to assess whether lopinavir-ritonavir improves outcomes in patients admitted to hospital with COVID-19. METHODS: In this randomised, controlled, open-label, platform trial, a range of possible treatments was compared with usual care in patients admitted to hospital with COVID-19. The trial is underway at 176 hospitals in the UK. Eligible and consenting patients were randomly allocated to either usual standard of care alone or usual standard of care plus lopinavir-ritonavir (400 mg and 100 mg, respectively) by mouth for 10 days or until discharge (or one of the other RECOVERY treatment groups: hydroxychloroquine, dexamethasone, or azithromycin) using web-based simple (unstratified) randomisation with allocation concealment. Randomisation to usual care was twice that of any of the active treatment groups (eg, 2:1 in favour of usual care if the patient was eligible for only one active group, 2:1:1 if the patient was eligible for two active groups). The primary outcome was 28-day all-cause mortality. Analyses were done on an intention-to-treat basis in all randomly assigned participants. The trial is registered with ISRCTN, 50189673, and ClinicalTrials.gov, NCT04381936. FINDINGS: Between March 19, 2020, and June 29, 2020, 1616 patients were randomly allocated to receive lopinavir-ritonavir and 3424 patients to receive usual care. Overall, 374 (23%) patients allocated to lopinavir-ritonavir and 767 (22%) patients allocated to usual care died within 28 days (rate ratio 1¬∑03, 95% CI 0¬∑91-1¬∑17; p=0¬∑60). Results were consistent across all prespecified subgroups of patients. We observed no significant difference in time until discharge alive from hospital (median 11 days [IQR 5 to >28] in both groups) or the proportion of patients discharged from hospital alive within 28 days (rate ratio 0¬∑98, 95% CI 0¬∑91-1¬∑05; p=0¬∑53). Among patients not on invasive mechanical ventilation at baseline, there was no significant difference in the proportion who met the composite endpoint of invasive mechanical ventilation or death (risk ratio 1¬∑09, 95% CI 0¬∑99-1¬∑20; p=0¬∑092). INTERPRETATION: In patients admitted to hospital with COVID-19, lopinavir-ritonavir was not associated with reductions in 28-day mortality, duration of hospital stay, or risk of progressing to invasive mechanical ventilation or death. These findings do not support the use of lopinavir-ritonavir for treatment of patients admitted to hospital with COVID-19. FUNDING: Medical Research Council and National Institute for Health Research.",the composite endpoint of invasive mechanical ventilation or death,1,NA,NA,clinical,survival,COVID-19,2020,10/8/20,10.1016/S0140-6736(20)32013-4
34717820,"BACKGROUND: Recent evidence indicates a potential therapeutic role of fluvoxamine for COVID-19. In the TOGETHER trial for acutely symptomatic patients with COVID-19, we aimed to assess the efficacy of fluvoxamine versus placebo in preventing hospitalisation defined as either retention in a COVID-19 emergency setting or transfer to a tertiary hospital due to COVID-19. METHODS: This placebo-controlled, randomised, adaptive platform trial done among high-risk symptomatic Brazilian adults confirmed positive for SARS-CoV-2 included eligible patients from 11 clinical sites in Brazil with a known risk factor for progression to severe disease. Patients were randomly assigned (1:1) to either fluvoxamine (100 mg twice daily for 10 days) or placebo (or other treatment groups not reported here). The trial team, site staff, and patients were masked to treatment allocation. Our primary outcome was a composite endpoint of hospitalisation defined as either retention in a COVID-19 emergency setting or transfer to tertiary hospital due to COVID-19 up to 28 days post-random assignment on the basis of intention to treat. Modified intention to treat explored patients receiving at least 24 h of treatment before a primary outcome event and per-protocol analysis explored patients with a high level adherence (>80%). We used a Bayesian analytic framework to establish the effects along with probability of success of intervention compared with placebo. The trial is registered at ClinicalTrials.gov (NCT04727424) and is ongoing. FINDINGS: The study team screened 9803 potential participants for this trial. The trial was initiated on June 2, 2020, with the current protocol reporting randomisation to fluvoxamine from Jan 20 to Aug 5, 2021, when the trial arms were stopped for superiority. 741 patients were allocated to fluvoxamine and 756 to placebo. The average age of participants was 50 years (range 18-102 years); 58% were female. The proportion of patients observed in a COVID-19 emergency setting for more than 6 h or transferred to a teritary hospital due to COVID-19 was lower for the fluvoxamine group compared with placebo (79 [11%] of 741 vs 119 [16%] of 756); relative risk [RR] 0¬∑68; 95% Bayesian credible interval [95% BCI]: 0¬∑52-0¬∑88), with a probability of superiority of 99¬∑8% surpassing the prespecified superiority threshold of 97¬∑6% (risk difference 5¬∑0%). Of the composite primary outcome events, 87% were hospitalisations. Findings for the primary outcome were similar for the modified intention-to-treat analysis (RR 0¬∑69, 95% BCI 0¬∑53-0¬∑90) and larger in the per-protocol analysis (RR 0¬∑34, 95% BCI, 0¬∑21-0¬∑54). There were 17 deaths in the fluvoxamine group and 25 deaths in the placebo group in the primary intention-to-treat analysis (odds ratio [OR] 0¬∑68, 95% CI: 0¬∑36-1¬∑27). There was one death in the fluvoxamine group and 12 in the placebo group for the per-protocol population (OR 0¬∑09; 95% CI 0¬∑01-0¬∑47). We found no significant differences in number of treatment emergent adverse events among patients in the fluvoxamine and placebo groups. INTERPRETATION: Treatment with fluvoxamine (100 mg twice daily for 10 days) among high-risk outpatients with early diagnosed COVID-19 reduced the need for hospitalisation defined as retention in a COVID-19 emergency setting or transfer to a tertiary hospital. FUNDING: FastGrants and The Rainwater Charitable Foundation. TRANSLATION: For the Portuguese translation of the abstract see Supplementary Materials section.","primary outcome was a composite endpoint of hospitalisation defined as either retention in a COVID-19 emergency setting or transfer to tertiary hospital due to COVID-19 up to 28 days post-random assignment. Key secondary outcomes include viral clearance, time to clinical improvement, number of days with respiratory symptoms, time to hospitalisation for any cause or due to COVID-19 progression, all-cause mortality and time to death from any causes, WHO clinical worsening scale score, days in hospital and on ventilator and adverse events, adverse reactions to the study medications, and the proportion of participants who are non-adherent with the study drugs. All secondary outcomes were assessed up to 28 days following randomisation.",>2,clinical,binary,clinical,survival,COVID-19,2022,10/31/21,10.1016/S2214-109X(21)00448-4
33534047,"PURPOSE: To determine whether a¬†6-day course of methylprednisolone (MP) improves outcome in patients with severe SARS-CoV'Äë2 (Corona Virus Disease 2019 [COVID-19]). METHODS: The study was a¬†multicentric open-label trial of COVID-19¬†patients who were aged 'â•'ÄØ18¬†years, receiving oxygen without mechanical ventilation, and with evidence of systemic inflammatory response who were assigned to standard of care (SOC) or SOC plus intravenous MP (40'ÄØmg bid for 3 days followed by 20'ÄØmg bid for 3 days). The primary outcome was a composite of death, admission to the intensive care unit, or requirement for noninvasive ventilation. Both intention-to-treat (ITT) and per protocol (PP) analyses were performed. RESULTS: A total of 91 patients were screened, and 64 were randomized (mean age70'ÄØ¬±'Äâ12¬†years). In the ITT analysis, 14 of 29¬†patients (48%) in the SOC group and 14 of 35 (40%) in the MP group suffered the composite endpoint (40% versus 20% in patients under 72¬†years and 67% versus 48% in those over 72¬†years; p'ÄØ='Äâ0.25). In the PP analysis, patients on MP had a¬†significantly lower risk of experiencing the composite endpoint (age-adjusted risk ratio 0.42; 95% confidence interval, CI 0.20-0.89; p'ÄØ='Äâ0.043). CONCLUSION: The planned sample size was not achieved, and our results should therefore be interpreted with caution. The use of MP had no significant effect on the primary endpoint in ITT analysis; however, the PP analysis showed a¬†beneficial effect due to MP, which consistent with other published trials support the use of glucocorticoids in severe cases of COVID-19.","a composite of death, admission to the intensive care unit, or requirement for noninvasive ventilation. The secondary outcomes included the effects on
the individual components of the composite endpoint
and the variation of the laboratory biomarkers between baseline and 6 days after inclusion (time window 4–8 days).",1,clinical,survival,NA,NA,COVID-19,2021,2/3/21,10.1007/s00508-020-01805-8
34461042,"BACKGROUND: Previous studies have suggested that haemodynamic-guided management using an implantable pulmonary artery pressure monitor reduces heart failure hospitalisations in patients with moderately symptomatic (New York Heart Association [NYHA] functional class III) chronic heart failure and a hospitalisation in the past year, irrespective of ejection fraction. It is unclear if these benefits extend to patients with mild (NYHA functional class II) or severe (NYHA functional class IV) symptoms of heart failure or to patients with elevated natriuretic peptides without a recent heart failure hospitalisation. This trial was designed to evaluate whether haemodynamic-guided management using remote pulmonary artery pressure monitoring could reduce heart failure events and mortality in patients with heart failure across the spectrum of symptom severity (NYHA funational class II-IV), including those with elevated natriuretic peptides but without a recent heart failure hospitalisation. METHODS: The randomised arm of the haemodynamic-GUIDEed management of Heart Failure (GUIDE-HF) trial was a multicentre, single-blind study at 118 centres in the USA and Canada. Following successful implantation of a pulmonary artery pressure monitor, patients with all ejection fractions, NYHA functional class II-IV chronic heart failure, and either a recent heart failure hospitalisation or elevated natriuretic peptides (based on a-priori thresholds) were randomly assigned (1:1) to either haemodynamic-guided heart failure management based on pulmonary artery pressure or a usual care control group. Patients were masked to their study group assignment. Investigators were aware of treatment assignment but did not have access to pulmonary artery pressure data for control patients. The primary endpoint was a composite of all-cause mortality and total heart failure events (heart failure hospitalisations and urgent heart failure hospital visits) at 12 months assessed in all randomly assigned patients. Safety was assessed in all patients. A pre-COVID-19 impact analysis for the primary and secondary outcomes was prespecified. This study is registered with ClinicalTrials.gov, NCT03387813. FINDINGS: Between March 15, 2018, and Dec 20, 2019, 1022 patients were enrolled, with 1000 patients implanted successfully, and follow-up was completed on Jan 8, 2021. There were 253 primary endpoint events (0¬∑563 per patient-year) among 497 patients in the haemodynamic-guided management group (treatment group) and 289 (0¬∑640 per patient-year) in 503 patients in the control group (hazard ratio [HR] 0¬∑88, 95% CI 0¬∑74-1¬∑05; p=0¬∑16). A prespecified COVID-19 sensitivity analysis using a time-dependent variable to compare events before COVID-19 and during the pandemic suggested a treatment interaction (p(interaction)=0¬∑11) due to a change in the primary endpoint event rate during the pandemic phase of the trial, warranting a pre-COVID-19 impact analysis. In the pre-COVID-19 impact analysis, there were 177 primary events (0¬∑553 per patient-year) in the intervention group and 224 events (0¬∑682 per patient-year) in the control group (HR 0¬∑81, 95% CI 0¬∑66-1¬∑00; p=0¬∑049). This difference in primary events almost disappeared during COVID-19, with a 21% decrease in the control group (0¬∑536 per patient-year) relative to pre-COVID-19, virtually no change in the treatment group (0¬∑597 per patient-year), and no difference between groups (HR 1¬∑11, 95% CI 0¬∑80-1¬∑55; p=0¬∑53). The cumulative incidence of heart failure events was not reduced by haemodynamic-guided management (0¬∑85, 0¬∑70-1¬∑03; p=0¬∑096) in the overall study analysis but was significantly decreased in the pre-COVID-19 impact analysis (0¬∑76, 0¬∑61-0¬∑95; p=0¬∑014). 1014 (99%) of 1022 patients had freedom from device or system-related complications. INTERPRETATION: Haemodynamic-guided management of heart failure did not result in a lower composite endpoint rate of mortality and total heart failure events compared with the control group in the overall study analysis. However, a pre-COVID-19 impact analysis indicated a possible benefit of haemodynamic-guided management on the primary outcome in the pre-COVID-19 period, primarily driven by a lower heart failure hospitalisation rate compared with the control group. FUNDING: Abbott.",The primary endpoint was a composite of all-cause mortality and total heart failure events (heart failure hospitalisations and urgent heart failure hospital visits) at 12 months assessed in all randomly assigned patients.,1,clinical,survival,NA,NA,acute heart failure,2021,8/30/21,10.1016/S0140-6736(21)01754-2
34800427,"BACKGROUND: Aspirin has been proposed as a treatment for COVID-19 on the basis of its anti-thrombotic properties. We aimed to evaluate the efficacy and safety of aspirin in patients admitted to hospital with COVID-19. METHODS: In this randomised, controlled, open-label, platform trial, several possible treatments were compared with usual care in patients hospitalised with COVID-19. The trial took place at 177 hospitals in the UK, two hospitals in Indonesia, and two hospitals in Nepal. Eligible and consenting adults were randomly allocated in a 1:1 ratio to either usual standard of care plus 150 mg aspirin once per day until discharge or usual standard of care alone using web-based simple (unstratified) randomisation with allocation concealment. The primary outcome was 28 day mortality. All analyses were done by intention to treat. The trial is registered with ISRCTN (50189673) and ClinicalTrials.gov (NCT04381936). FINDINGS: Between Nov 1, 2020, and March 21, 2021, 14'Äâ892 (66%) of 22'Äâ560 patients enrolled into the RECOVERY trial were eligible to be randomly allocated to aspirin. 7351 patients were randomly allocated (1:1) to receive aspirin and 7541 patients to receive usual care alone. Overall, 1222 (17%) of 7351 patients allocated to aspirin and 1299 (17%) of 7541 patients allocated to usual care died within 28 days (rate ratio 0¬∑96, 95% CI 0¬∑89-1¬∑04; p=0¬∑35). Consistent results were seen in all prespecified subgroups of patients. Patients allocated to aspirin had a slightly shorter duration of hospitalisation (median 8 days, IQR 5 to >28, vs 9 days, IQR 5 to >28) and a higher proportion were discharged from hospital alive within 28 days (75% vs 74%; rate ratio 1¬∑06, 95% CI 1¬∑02-1¬∑10; p=0¬∑0062). Among patients not on invasive mechanical ventilation at baseline, there was no significant difference in the proportion meeting the composite endpoint of invasive mechanical ventilation or death (21% vs 22%; risk ratio 0¬∑96, 95% CI 0¬∑90-1¬∑03; p=0¬∑23). Aspirin use was associated with a reduction in thrombotic events (4¬∑6% vs 5¬∑3%; absolute reduction 0¬∑6%, SE 0¬∑4%) and an increase in major bleeding events (1¬∑6% vs 1¬∑0%; absolute increase 0¬∑6%, SE 0¬∑2%). INTERPRETATION: In patients hospitalised with COVID-19, aspirin was not associated with reductions in 28 day mortality or in the risk of progressing to invasive mechanical ventilation or death, but was associated with a small increase in the rate of being discharged alive within 28 days. FUNDING: UK Research and Innovation (Medical Research Council), National Institute of Health Research, and the Wellcome Trust through the COVID-19 Therapeutics Accelerator.","The primary outcome was 28 day mortality. Secondary outcomes were time to discharge from hospital, and, among patients not on invasive mechanical ventilation at randomisation, progression to invasive mechanical ventilation (including extracorporeal membrane oxygenation) or death.",1,NA,NA,clinical,survival,COVID-19,2022,11/20/21,10.1016/S0140-6736(21)01825-0
34672950,"BACKGROUND: Colchicine has been proposed as a treatment for COVID-19 based on its anti-inflammatory actions. We aimed to evaluate the efficacy and safety of colchicine in patients admitted to hospital with COVID-19. METHODS: In this streamlined, randomised, controlled, open-label trial, underway at 177 hospitals in the UK, two hospitals in Indonesia, and two hospitals in Nepal, several possible treatments were compared with usual care in patients hospitalised with COVID-19. Patients were eligible for inclusion in the study if they were admitted to hospital with clinically suspected or laboratory confirmed SARS-CoV-2 infection and had no medical history that might, in the opinion of the attending clinician, put the patient at significant risk if they were to participate in the trial. Eligible and consenting adults were randomly assigned (1:1) to receive either usual standard of care alone (usual care group) or usual standard of care plus colchicine (colchicine group) using web-based simple (unstratified) randomisation with allocation concealment. Participants received colchicine 1 mg after randomisation followed by 500 Œºg 12 h later and then 500 Œºg twice a day by mouth or nasogastric tube for 10 days in total or until discharge. Dose frequency was halved for patients receiving a moderate CYP3A4 inhibitor (eg, diltiazem), patients with an estimated glomerular filtration rate of less than 30 mL/min per 1¬∑73m(2), and those with an estimated bodyweight of less than 70 kg. The primary outcome was 28-day mortality, secondary endpoints included time to discharge, the proportion of patients discharged from hospital within 28 days, and, in patients not on invasive mechanical ventilation at randomisation, a composite endpoint of invasive mechanical ventilation or death. All analyses were by intention-to-treat. The trial is registered with ISRCTN, 50189673, and ClinicalTrials.gov, NCT04381936. FINDINGS: Between Nov 27, 2020, and March 4, 2021, 11'Äà340 (58%) of 19'Äà423 patients enrolled into the RECOVERY trial were eligible to receive colchicine; 5610 (49%) patients were randomly assigned to the colchicine group and 5730 (51%) to the usual care group. Overall, 1173 (21%) patients in the colchicine group and 1190 (21%) patients in the usual care group died within 28 days (rate ratio 1¬∑01 [95% CI 0¬∑93 to 1¬∑10]; p=0¬∑77). Consistent results were seen in all prespecified subgroups of patients. Median time to discharge alive (10 days [IQR 5 to >28]) was the same in both groups, and there was no significant difference in the proportion of patients discharged from hospital alive within 28 days (3901 [70%] patients in the colchicine group and 4032 [70%] usual care group; rate ratio 0¬∑98 [95% CI 0¬∑94 to 1¬∑03]; p=0¬∑44). In those not on invasive mechanical ventilation at baseline, there was no significant difference in the proportion meeting the composite endpoint of invasive mechanical ventilation or death (1344 [25%] in the colchicine group vs 1343 [25%] patients in the usual care group; risk ratio 1¬∑02 [95% CI 0¬∑96 to 1¬∑09]; p=0¬∑47). INTERPRETATION: In adults hospitalised with COVID-19, colchicine was not associated with reductions in 28-day mortality, duration of hospital stay, or risk of progressing to invasive mechanical ventilation or death. FUNDING: UK Research and Innovation (Medical Research Council), National Institute of Health Research, and Wellcome Trust.",a composite endpoint of invasive mechanical ventilation or death,1,NA,NA,clinical,survival,COVID-19,2021,10/21/21,10.1016/S2213-2600(21)00435-5
25436213,"BACKGROUND: Diuresis is a major therapy for the reduction of congestive symptoms in acute decompensated heart failure (ADHF) patients. We previously reported the efficacy and safety of tolvaptan compared to carperitide in hospitalized patients with ADHF. There were some reports of cardio- and renal-protective effects in carperitide; therefore, the purpose of this study was to compare the long-term effects of tolvaptan and carperitide on cardiorenal function and prognosis. METHODS AND RESULTS: One hundred and five ADHF patients treated with either tolvaptan or carperitide were followed after hospital discharge. Levels of plasma B-type natriuretic peptide, serum sodium, potassium, creatinine, and estimated glomerular filtration rate were measured before administration of tolvaptan or carperitide at baseline, the time of discharge, and one year after discharge. These data between tolvaptan and carperitide groups were not different one year after discharge. Kaplan-Meier survival curves demonstrated that the event-free rate regarding all events, cardiac events, all cause deaths, and rehospitalization due to worsening heart failure was not significantly different between tolvaptan and carperitide groups. CONCLUSIONS: We demonstrated that tolvaptan had similar effects on cardiac and renal function and led to a similar prognosis in the long term, compared to carperitide.","The endpoints, which were judged independently by researchers, were (1) all cause death, (2) cardiac death, defined as death from worsening heart failure or sudden cardiac death, and (3)rehospitalization due to worsening heart failure. There were 29 cardiac events (10 all cause deaths including 5 cardiac deaths and 19 rehospitalization) during the follow-up period in all subjects. Cumulative event-free survival curves were illustrated by the Kaplan-Meier method and compared by a log rank test (Figure 4). Event-free rates regarding all events (a), cardiac events (b), all cause deaths (c), and rehospitalizations due to worsening heart failure (d) were not significantly different between the tolvaptan group and carperitide group (all events: 72.5% versus 72.2%, P = 0.8647; cardiac events: 74.5% versus 79.6%, P = 0.4561; all cause deaths: 94.1% versus 87.0%, P = 0.3011; rehospitalization due to worsening heart failure: 78.4% versus 85.1%, P = 0.3362)
the[ event-free rate regarding] all events, [cardiac events], all cause deaths, and rehospitalization",1,clinical,survival,NA,NA,acute heart failure,2014,12/2/14,10.1155/2014/704289
27404673,"BACKGROUND: Renal dysfunction is a common comorbidity in acute heart failure (AHF) patients. The prognostic significance of early treatment with tolvaptan in AHF patients complicated with renal dysfunction has not been elucidated. METHODS: Post hoc analysis was performed on a randomized clinical study for prespecified prognostic endpoints and prespecified subgroups. 217 AHF patients with renal dysfunction (eGFR 15 to 60mL/min/1.73m(2)) were randomized within 6h from hospitalization to either tolvaptan treatment for 2days or conventional treatment. The primary outcome was the combined endpoint of all-cause death and HF readmission. RESULTS: During follow-up (636days, median) 99 patients experienced combined endpoint and 53 patients died. There was no significant difference in event-free survival rate for either the combined events (Log-rank: P=0.197) or all-cause death (Log-rank: P=0.894) between tolvaptan and conventional groups. In prespecified subgroup analysis, in patients whose BUN/creatinine ratio was above the median (>20), tolvaptan significantly reduced the risk of combined events (HR: 0.52, 95% CI: 0.30-0.91, P=0.021) with a significant interaction (P value for interaction=0.045). Likewise, in patients whose eGFR was 30mL/min/1.73m(2) or above, tolvaptan reduced the risk of combined events (HR: 0.54, 95% CI: 0.32-0.90, P=0.017) with a significant interaction (P value for interaction=0.015). CONCLUSION: Short-term use of tolvaptan in acute-phase in AHF with renal dysfunction showed a neutral effect on prognosis. Patients with relatively preserved renal function and relatively high BUN/creatinine ratios are potentially favorable subgroups for treatment with tolvaptan.",The primary outcome was the combined endpoint of all-cause death and HF readmission. The secondary endpoint was all-cause mortality.,1,clinical,survival,NA,NA,acute heart failure,2016,7/13/16,10.1016/j.ijcard.2016.07.063
