pmid,abstract,composite_endpoints,num_of_composite,composite_type1,composite_stats_type1,composite_type2,composite_stats_type2,disease_cat,publication_year,create_date,doi
35040887,"IMPORTANCE: Platelets represent a potential therapeutic target for improved clinical outcomes in patients with COVID-19. OBJECTIVE: To evaluate the benefits and risks of adding a P2Y12 inhibitor to anticoagulant therapy among non-critically ill patients hospitalized for COVID-19. DESIGN, SETTING, AND PARTICIPANTS: An open-label, bayesian, adaptive randomized clinical trial including 562 non-critically ill patients hospitalized for COVID-19 was conducted between February 2021 and June 2021 at 60 hospitals in Brazil, Italy, Spain, and the US. The date of final 90-day follow-up was September 15, 2021. INTERVENTIONS: Patients were randomized to a therapeutic dose of heparin plus a P2Y12 inhibitor (n = 293) or a therapeutic dose of heparin only (usual care) (n = 269) in a 1:1 ratio for 14 days or until hospital discharge, whichever was sooner. Ticagrelor was the preferred P2Y12 inhibitor. MAIN OUTCOMES AND MEASURES: The composite primary outcome was organ support-free days evaluated on an ordinal scale that combined in-hospital death (assigned a value of -1) and, for those who survived to hospital discharge, the number of days free of respiratory or cardiovascular organ support up to day 21 of the index hospitalization (range, -1 to 21 days; higher scores indicate less organ support and better outcomes). The primary safety outcome was major bleeding by 28 days as defined by the International Society on Thrombosis and Hemostasis. RESULTS: Enrollment of non-critically ill patients was discontinued when the prespecified criterion for futility was met. All 562 patients who were randomized (mean age, 52.7 [SD, 13.5] years; 41.5% women) completed the trial and 87% received a therapeutic dose of heparin by the end of study day 1. In the P2Y12 inhibitor group, ticagrelor was used in 63% of patients and clopidogrel in 37%. The median number of organ support-free days was 21 days (IQR, 20-21 days) among patients in the P2Y12 inhibitor group and was 21 days (IQR, 21-21 days) in the usual care group (adjusted odds ratio, 0.83 [95% credible interval, 0.55-1.25]; posterior probability of futility [defined as an odds ratio <1.2], 96%). Major bleeding occurred in 6 patients (2.0%) in the P2Y12 inhibitor group and in 2 patients (0.7%) in the usual care group (adjusted odds ratio, 3.31 [95% CI, 0.64-17.2]; P = .15). CONCLUSIONS AND RELEVANCE: Among non-critically ill patients hospitalized for COVID-19, the use of a P2Y12 inhibitor in addition to a therapeutic dose of heparin, compared with a therapeutic dose of heparin only, did not result in an increased odds of improvement in organ support-free days within 21 days during hospitalization. TRIAL REGISTRATION: ClinicalTrials.gov Identifier: NCT04505774.","The composite primary outcome was organ support-free days evaluated on an ordinal scale that combined in-hospital death (assigned a value of -1) and, for those who survived to hospital discharge, the number of days free of respiratory or cardiovascular organ support up to day 21 of the index hospitalization (range, -1 to 21 days.            A key secondary outcome was major thrombotic events or death by 28 days (a composite outcome of myocardial infarction, pulmonary embolism, ischemic stroke, systemic arterial embolism, and in-hospital death). Secondary efficacy outcomes included all thrombotic events (major thrombotic events plus deep venous thrombosis) or death by 28 days.",2,clinical,ordinal,clinical,binary,COVID-19,2022,1/18/22,10.1001/jama.2021.23605
34244316,"BACKGROUND: The effects of convalescent plasma (CP) therapy in hospitalised patients with coronavirus disease 2019 (COVID-19) remain uncertain. This study investigates the effect of CP on clinical improvement in these patients. METHODS: This is an investigator-initiated, randomised, parallel arm, open-label, superiority clinical trial. Patients were randomly (1:1) assigned to two infusions of CP plus standard of care (SOC) or SOC alone. The primary outcome was the proportion of patients with clinical improvement 28 days after enrolment. RESULTS: A total of 160 (80 in each arm) patients (66.3% critically ill, 33.7% severely ill) completed the trial. The median (interquartile range (IQR)) age was 60.5 (48-68) years; 58.1% were male and the median (IQR) time from symptom onset to randomisation was 10 (8-12) days. Neutralising antibody titres >1:80 were present in 133 (83.1%) patients at baseline. The proportion of patients with clinical improvement on day 28 was 61.3% in the CP+SOC group and 65.0% in the SOC group (difference -3.7%, 95% CI -18.8-11.3%). The results were similar in the severe and critically ill subgroups. There was no significant difference between CP+SOC and SOC groups in pre-specified secondary outcomes, including 28-day mortality, days alive and free of respiratory support and duration of invasive ventilatory support. Inflammatory and other laboratory marker values on days 3, 7 and 14 were similar between groups. CONCLUSIONS: CP+SOC did not result in a higher proportion of clinical improvement on day 28 in hospitalised patients with COVID-19 compared to SOC alone.",The primary outcome was the proportion of patients with clinical improvement 28 days after enrollment. Clinical improvement was defined as hospital discharge or reduction of 2_points in a six-level ordinal scale. Levels on the scale were defined as follows. 1=not hospitalised; 2=hospitalised and not receiving supplemental oxygen; 3=hospitalised and receiving supplemental oxygen; 4=hospitalised and receiving oxygen supplementation administered by a high-flow nasal cannula or noninvasive ventilation; 5=hospitalised and receiving mechanical ventilation or extracorporeal membrane oxygenation; and 6=death. Pre-specified secondary outcomes included RT-PCR for SARS-CoV-2 from nasal and oropharyngeal swab at day 7 from enrolment or hospital discharge (if earlier than 7_days); clinical status assessed using the six-level ordinal scale and all-cause mortality at days 14 and 28 after enrolment; time to hospital discharge and days alive and free of supplemental oxygen support (nonsurvivors and patients requiring oxygen support at day 28 were assigned as 0 supplemental oxygen support-free days) within 28_days of enrolment; Sequential Organ Failure Assessment (SOFA) score and National Early Warning Score (NEWS) 2 on day 7 after enrolment; and length of invasive ventilatory support (for those who received mechanical ventilation).,>2,clinical,binary,clinical,ordinal,COVID-19,2022,7/10/21,10.1183/13993003.01471-2021
33752127,"BACKGROUND: The antifungal drug itraconazole exerts in vitro activity against SARS-CoV-2 in Vero and human Caco-2 cells. Preclinical and clinical studies are required to investigate if itraconazole is effective for the treatment and/or prevention of COVID-19. METHODS: Due to the initial absence of preclinical models, the effect of itraconazole was explored in a clinical, proof-of-concept, open-label, single-center study, in which hospitalized COVID-19 patients were randomly assigned to standard of care with or without itraconazole. Primary outcome was the cumulative score of the clinical status until day 15 based on the 7-point ordinal scale of the World Health Organization. In parallel, itraconazole was evaluated in a newly established hamster model of acute SARS-CoV-2 infection and transmission, as soon as the model was validated. FINDINGS: In the hamster acute infection model, itraconazole did not reduce viral load in lungs, stools or ileum, despite adequate plasma and lung drug concentrations. In the transmission model, itraconazole failed to prevent viral transmission. The clinical trial was prematurely discontinued after evaluation of the preclinical studies and because an interim analysis showed no signal for a more favorable outcome with itraconazole: mean cumulative score of the clinical status 49 vs 47, ratio of geometric means 1.01 (95% CI 0.85 to 1.19) for itraconazole vs standard of care. INTERPRETATION: Despite in vitro activity, itraconazole was not effective in a preclinical COVID-19 hamster model. This prompted the premature termination of the proof-of-concept clinical study. FUNDING: KU Leuven, Research Foundation - Flanders (FWO), Horizon 2020, Bill and Melinda Gates Foundation.","Primary outcome was the cumulative score of the clinical status until day 15 based on the 7-point ordinal scale of the World Health Organization. 1) not hospitalized, no limitations on activities; 2) not hospitalized, limitations on activities; 3) hospitalized, not requiring supplemental oxygen; 4) hospitalized, requiring supplemental oxygen; 5) hospitalized, on non-invasive ventilation or high flow oxygen devices; 6) hospitalized, requiring extracorporeal membrane oxygenation (ECMO) or invasive mechanical ventilation; and 7) death.   The secondary outcome was defined as time to sustained clinical improvement or live discharge, whichever comes first, whereby a sustained clinical improvement is defined as an improvement of more than 2 points on the 7-point ordinal scale versus the highest value of day 0 and 1 and sustained for at least 3 days. Other secondary outcomes included: time to events (admission to ICU, death, discharge); mortality on day 29, duration of supplemental oxygen, need for and duration of mechanical ventilation, duration of hospitalization, duration of intensive care stay, daily National Early Warning Score (NEWS).",2,mixed,ordinal,mixed,survival,COVID-19,2021,3/22/21,10.1016/j.ebiom.2021.103288
35045989,"BACKGROUND: The role of remdesivir in the treatment of patients in hospital with COVID-19 remains ill defined in a global context. The World Health Organization Solidarity randomized controlled trial (RCT) evaluated remdesivir in patients across many countries, with Canada enrolling patients using an expanded data collection format in the Canadian Treatments for COVID-19 (CATCO) trial. We report on the Canadian findings, with additional demographics, characteristics and clinical outcomes, to explore the potential for differential effects across different health care systems. METHODS: We performed an open-label, pragmatic RCT in Canadian hospitals, in conjunction with the Solidarity trial. We randomized patients to 10 days of remdesivir (200 mg intravenously [IV] on day 0, followed by 100 mg IV daily), plus standard care, or standard care alone. The primary outcome was in-hospital mortality. Secondary outcomes included changes in clinical severity, oxygen- and ventilator-free days (at 28 d), incidence of new oxygen or mechanical ventilation use, duration of hospital stay, and adverse event rates. We performed a priori subgroup analyses according to duration of symptoms before enrolment, age, sex and severity of symptoms on presentation. RESULTS: Across 52 Canadian hospitals, we randomized 1282 patients between Aug. 14, 2020, and Apr. 1, 2021, to remdesivir (n = 634) or standard of care (n = 648). Of these, 15 withdrew consent or were still in hospital, for a total sample of 1267 patients. Among patients assigned to receive remdesivir, in-hospital mortality was 18.7%, compared with 22.6% in the standard-of-care arm (relative risk [RR] 0.83 (95% confidence interval [CI] 0.67 to 1.03), and 60-day mortality was 24.8% and 28.2%, respectively (95% CI 0.72 to 1.07). For patients not mechanically ventilated at baseline, the need for mechanical ventilation was 8.0% in those assigned remdesivir, and 15.0% in those receiving standard of care (RR 0.53, 95% CI 0.38 to 0.75). Mean oxygen-free and ventilator-free days at day 28 were 15.9 (± standard deviation [SD] 10.5) and 21.4 (± SD 11.3) in those receiving remdesivir and 14.2 (± SD 11) and 19.5 (± SD 12.3) in those receiving standard of care (p = 0.006 and 0.007, respectively). There was no difference in safety events of new dialysis, change in creatinine, or new hepatic dysfunction between the 2 groups. INTERPRETATION: Remdesivir, when compared with standard of care, has a modest but significant effect on outcomes important to patients and health systems, such as the need for mechanical ventilation. Trial registration: ClinicalTrials.gov, no. NCT04330690.","The primary outcome was in-hospital mortality. Secondary outcomes included [changes in clinical severity], [oxygen- and ventilator-free days (at 28 d)], incidence of new oxygen or mechanical ventilation use, duration of hospital stay, and adverse event rates.",>2,NA,NA,clinical,continuous,COVID-19,2022,1/20/22,10.1503/cmaj.211698
34672949,"BACKGROUND: Functional impairment of interferon, a natural antiviral component of the immune system, is associated with the pathogenesis and severity of COVID-19. We aimed to compare the efficacy of interferon beta-1a in combination with remdesivir compared with remdesivir alone in hospitalised patients with COVID-19. METHODS: We did a double-blind, randomised, placebo-controlled trial at 63 hospitals across five countries (Japan, Mexico, Singapore, South Korea, and the USA). Eligible patients were hospitalised adults (aged ≥18 years) with SARS-CoV-2 infection, as confirmed by a positive RT-PCR test, and who met one of the following criteria suggestive of lower respiratory tract infection: the presence of radiographic infiltrates on imaging, a peripheral oxygen saturation on room air of 94% or less, or requiring supplemental oxygen. Patients were excluded if they had either an alanine aminotransferase or an aspartate aminotransferase concentration more than five times the upper limit of normal; had impaired renal function; were allergic to the study product; were pregnant or breast feeding; were already on mechanical ventilation; or were anticipating discharge from the hospital or transfer to another hospital within 72 h of enrolment. Patients were randomly assigned (1:1) to receive intravenous remdesivir as a 200 mg loading dose on day 1 followed by a 100 mg maintenance dose administered daily for up to 9 days and up to four doses of either 44 μg interferon beta-1a (interferon beta-1a group plus remdesivir group) or placebo (placebo plus remdesivir group) administered subcutaneously every other day. Randomisation was stratified by study site and disease severity at enrolment. Patients, investigators, and site staff were masked to interferon beta-1a and placebo treatment; remdesivir treatment was given to all patients without masking. The primary outcome was time to recovery, defined as the first day that a patient attained a category 1, 2, or 3 score on the eight-category ordinal scale within 28 days, assessed in the modified intention-to-treat population, defined as all randomised patients who were classified according to actual clinical severity. Safety was assessed in the as-treated population, defined as all patients who received at least one dose of the assigned treatment. This trial is registered with ClinicalTrials.gov, NCT04492475. FINDINGS: Between Aug 5, 2020, and Nov 11, 2020, 969 patients were enrolled and randomly assigned to the interferon beta-1a plus remdesivir group (n=487) or to the placebo plus remdesivir group (n=482). The mean duration of symptoms before enrolment was 8·7 days (SD 4·4) in the interferon beta-1a plus remdesivir group and 8·5 days (SD 4·3) days in the placebo plus remdesivir group. Patients in both groups had a time to recovery of 5 days (95% CI not estimable) (rate ratio of interferon beta-1a plus remdesivir group vs placebo plus remdesivir 0·99 [95% CI 0·87-1·13]; p=0·88). The Kaplan-Meier estimate of mortality at 28 days was 5% (95% CI 3-7%) in the interferon beta-1a plus remdesivir group and 3% (2-6%) in the placebo plus remdesivir group (hazard ratio 1·33 [95% CI 0·69-2·55]; p=0·39). Patients who did not require high-flow oxygen at baseline were more likely to have at least one related adverse event in the interferon beta-1a plus remdesivir group (33 [7%] of 442 patients) than in the placebo plus remdesivir group (15 [3%] of 435). In patients who required high-flow oxygen at baseline, 24 (69%) of 35 had an adverse event and 21 (60%) had a serious adverse event in the interferon beta-1a plus remdesivir group compared with 13 (39%) of 33 who had an adverse event and eight (24%) who had a serious adverse event in the placebo plus remdesivir group. INTERPRETATION: Interferon beta-1a plus remdesivir was not superior to remdesivir alone in hospitalised patients with COVID-19 pneumonia. Patients who required high-flow oxygen at baseline had worse outcomes after treatment with interferon beta-1a compared with those given placebo. FUNDING: The National Institute of Allergy and Infectious Diseases (USA).","The primary outcome was time to recovery, defined as the first day that a patient attained a category 1, 2, or 3 score on the eight-category ordinal scale within 28 day.  The key secondary outcome measure was the odds of improved clinical status (defined by the ordinal scale distribution of the study groups) at 14 days. Other secondary outcome measures were time to improvement by one or two categories from baseline ordinal score; clinical status according to the ordinal scale at days 3, 5, 8, 11, 15, 22, and 29; mean change in the ordinal scale from day 1 to days 3, 5, 8, 11, 15, 22, and 29; time to discharge or to a NEWS of 2 or less and maintained for 24 h, whichever occurred first; change in NEWS from day 1 to days 3, 5, 8, 11, 15, and 29; number of days of supplemental oxygen, and non-invasive ventilation or high-flow oxygen (if on these at baseline); incidence and duration of new supplemental oxygen use, non-invasive ventilation or high-flow oxygen, and invasive ventilation or extracorporeal membrane oxygenation; duration of hospitalisation up to day 29 (patients who remained hospitalised at day 29 were assigned value of 28 days); mortality at 14 and 28 days after enrolment; and changes in laboratory values over time.    Ordinal scale in supp:1 Not hospitalized, with no limitations on activities.
2 Not hospitalized, limitation on activities and/or requiring home oxygen.
3 Hospitalized, not requiring supplemental oxygen  no longer requires ongoing medical care.
4 Hospitalized, not requiring supplemental oxygen, requiring ongoing medical care (Covid-19-related or otherwise)
5 Hospitalized, requiring supplemental oxygen by low-flow devices
6 Hospitalized, on non-invasive ventilation or on high-flow oxygen devices
7 Hospitalized, on invasive mechanical ventilation or extracorporeal membrane oxygenation
8 Death",>2,mixed,survival,mixed,survival,COVID-19,2021,10/21/21,10.1016/S2213-2600(21)00384-2
35093205,"BACKGROUND: Passive immunotherapy using hyperimmune intravenous immunoglobulin (hIVIG) to SARS-CoV-2, derived from recovered donors, is a potential rapidly available, specific therapy for an outbreak infection such as SARS-CoV-2. Findings from randomised clinical trials of hIVIG for the treatment of COVID-19 are limited. METHODS: In this international randomised, double-blind, placebo-controlled trial, hospitalised patients with COVID-19 who had been symptomatic for up to 12 days and did not have acute end-organ failure were randomly assigned (1:1) to receive either hIVIG or an equivalent volume of saline as placebo, in addition to remdesivir, when not contraindicated, and other standard clinical care. Randomisation was stratified by site pharmacy; schedules were prepared using a mass-weighted urn design. Infusions were prepared and masked by trial pharmacists; all other investigators, research staff, and trial participants were masked to group allocation. Follow-up was for 28 days. ecomplications and ranged from no limiting symptoms to death. Deaths and adverse events, including organ failure and serious infections, were used to define composite safety outcomes at days 7 and 28. Prespecified subgroup analyses were carried out for efficacy and safety outcomes by duration of symptoms, the presence of anti-spike neutralising antibodies, and other baseline factors. Analyses were done on a modified intention-to-treat (mITT) population, which included all randomly assigned participants who met eligibility criteria and received all or part of the assigned study product infusion. This study is registered with ClinicalTrials.gov, NCT04546581. FINDINGS: From Oct 8, 2020, to Feb 10, 2021, 593 participants (n=301 hIVIG, n=292 placebo) were enrolled at 63 sites in 11 countries; 579 patients were included in the mITT analysis. Compared with placebo, the hIVIG group did not have significantly greater odds of a more favourable outcome at day 7; the adjusted OR was 1·06 (95% CI 0·77-1·45; p=0·72). Infusions were well tolerated, although infusion reactions were more common in the hIVIG group (18·6% vs 9·5% for placebo; p=0·002). The percentage with the composite safety outcome at day 7 was similar for the hIVIG (24%) and placebo groups (25%; OR 0·98, 95% CI 0·66-1·46; p=0·91). The ORs for the day 7 ordinal outcome did not vary for subgroups considered, but there was evidence of heterogeneity of the treatment effect for the day 7 composite safety outcome: risk was greater for hIVIG compared with placebo for patients who were antibody positive (OR 2·21, 95% CI 1·14-4·29); for patients who were antibody negative, the OR was 0·51 (0·29-0·90; p(interaction)=0·001). INTERPRETATION: When administered with standard of care including remdesivir, SARS-CoV-2 hIVIG did not demonstrate efficacy among patients hospitalised with COVID-19 without end-organ failure. The safety of hIVIG might vary by the presence of endogenous neutralising antibodies at entry. FUNDING: US National Institutes of Health.","The primary endpoint was an ordinal outcome based on the patient's clinical status on day 7 (appendix p 14). The seven categories of this outcome ranged from return to usual activities with no more than minimal symptoms due to COVID-19, to death. They reflect oxygen requirements and a range of organ dysfunction, and were modified from similar outcomes in earlier influenza and COVID-19 studies.  Serious adverse events included organ failure events and serious infections, which were reported as secondary endpoints separately from other serious adverse events. Scales:
7. Death 
6. End-organ failure
5. Life-threatening end-organ dysfunction 4. Serious end-organ dysfunction
3. Moderate end-organ dysfunction
2. Limiting symptoms due to COVID-19
1. No limiting symptoms due to COVID-19",2,mixed,ordinal,clinical,binary,COVID-19,2022,1/30/22,10.1016/S0140-6736(22)00101-5
34376401,"RATIONALE: Convalescent plasma (CCP) has been studied as a potential therapy for COVID-19, but data on its efficacy in Africa are limited. OBJECTIVE: In this trial we set out to determine the efficacy of CCP for treatment of COVID-19 in Uganda. MEASUREMENTS: Patients with a positive SARS-CoV-2 reverse transcriptase (RT)-PCR test irrespective of disease severity were hospitalised and randomised to receive either COVID-19 CCP plus standard of care (SOC) or SOC alone. The primary outcome was time to viral clearance, defined as having two consecutive RT-PCR-negative tests by day 28. Secondary outcomes included time to symptom resolution, clinical status on the modified WHO Ordinal Clinical Scale (≥1-point increase), progression to severe/critical condition (defined as oxygen saturation <93% or needing oxygen), mortality and safety. MAIN RESULTS: A total of 136 patients were randomised, 69 to CCP+SOC and 67 to SOC only. The median age was 50 years (IQR: 38.5-62.0), 71.3% were male and the median duration of symptom was 7 days (IQR=4-8). Time to viral clearance was not different between the CCP+SOC and SOC arms (median of 6 days (IQR=4-11) vs 4 (IQR=4-6), p=0.196). There were no statistically significant differences in secondary outcomes in CCP+SOC versus SOC: time to symptom resolution (median=7 (IQR=5-7) vs 7 (IQR=5-10) days, p=0.450), disease progression (9 (22.0%) vs 7 (24.0%) patients, p=0.830) and mortality (10 (14.5%) vs 8 (11.9%) deaths, p=0.476). CONCLUSION: In this African trial, CCP therapy did not result in beneficial virological or clinical improvements. Further trials are needed to determine subgroups of patients who may benefit from CCP in Africa.Trial registration number NCT04542941.","The primary outcome was time to viral clearance, defined as having two consecutive RT-PCR-negative tests by day 28. Secondary outcomes included [time to symptom resolution], [clinical status on the modified WHO Ordinal Clinical Scale (≥1-point increase)], [progression to severe/critical condition (defined as oxygen saturation <93% or needing oxygen)], mortality and safety.",>2,NA,NA,mixed,survival,COVID-19,2021,8/11/21,10.1136/bmjresp-2021-001017
